<?xml version="1.0" encoding="UTF-8"?>
<!-- The description of the galactic entities -->
<galaxy xmlns:xsi="http://www.w3.org/2001/XMLSchema-instance" xsi:noNamespaceSchemaLocation="../../schemas/galaxy.xsd">
	<background min-scale="0.5" max-scale="4" image="starmap/background"/>
	<planets>
		<planet type="neptoplasm" label="planet.type.neptoplasm">
			<body>starmap/planets/planet_alien_30x30</body>
			<equipment>colony/surfaces/neptoplasm/equipment_neptoplasm</equipment>
			<spacewar>colony/surfaces/neptoplasm/spacewar_neptoplasm</spacewar>
			<tileset pattern="colony/surfaces/neptoplasm/tile_neptoplasm_%03d">
				<tile-range start="21" end="26"/>
				<!-- width is the up-right and height is the down-right direction. -->
				<tile-range start="27" end="42" width="2" height="2"/>
				<tile id="43" width="3" height="2"/>
				<tile id="44" width="2" height="3"/>
				<tile id="45" width="3" height="3"/>
				<tile id="46" width="2" height="3"/>
				<tile id="47" width="2" height="3"/>
				<tile id="48" width="2" height="3"/>
				<tile-range start="49" end="57" width="4" height="4"/>
			</tileset>
			<map pattern="campaign/main/surfaces/neptoplasm_%d" start="1" end="6"/>
			<weather frequency='2880' duration='180' drop-type='RAIN'/>
		</planet>
		<planet type="cratered" label="planet.type.cratered">
			<body>starmap/planets/planet_cratered_30x30</body>
			<equipment>colony/surfaces/cratered/equipment_cratered</equipment>
			<spacewar>colony/surfaces/cratered/spacewar_cratered</spacewar>
			<tileset pattern="colony/surfaces/cratered/tile_cratered_%03d">
				<tile-range start="21" end="60"/>
				<tile id="61" width="2"/>
				<tile id="62" height="2"/>
				<tile-range start="63" end="86" width="2" height="2"/>
				<tile-range start="87" end="89" width="3" height="2"/>
				<tile id="90" width="4" height="2"/>
				<tile id="91" width="2" height="3"/>
				<tile-range start="92" end="94" width="3" height="3"/>
				<tile id="95" width="4" height="3"/>
				<tile id="96" width="2" height="4"/>
				<tile id="97" width="4" height="4"/>
			</tileset>
			<map pattern="campaign/main/surfaces/cratered_%d" start="1" end="9"/>
			<weather frequency='4320' duration='120' drop-type='SNOW'/>
		</planet>
		<planet type="desert" label="planet.type.desert">
			<body>starmap/planets/planet_desert_30x30</body>
			<equipment>colony/surfaces/desert/equipment_desert</equipment>
			<spacewar>colony/surfaces/desert/spacewar_desert</spacewar>
			<tileset pattern="colony/surfaces/desert/tile_desert_%03d">
				<tile-range start="21" end="54"/>
				<tile-range start="55" end="68" width="2" height="2"/>
				<tile id="69" height="2"/>
				<tile id="70" width="2" height="3"/>
				<tile-range start="71" end="74" width="3" height="3"/>
				<tile id="75" width="3" height="4"/>
				<tile-range start="76" end="79" width="4" height="4"/>
			</tileset>
			<map pattern="campaign/main/surfaces/desert_%d" start="1" end="9"/>
			<weather frequency='43200' duration='600' drop-type='RAIN'/>
		</planet>
		<planet type="earth" label="planet.type.earth">
			<body>starmap/planets/planet_earth_30x30</body>
			<equipment>colony/surfaces/earth/equipment_earth</equipment>
			<spacewar>colony/surfaces/earth/spacewar_earth</spacewar>
			<tileset pattern="colony/surfaces/earth/tile_earth_%03d">
				<tile-range start="21" end="107"/>
				<tile id="108" height="2"/>
				<tile-range start="109" end="130" width="2" height="2"/>
				<tile-range start="131" end="139" width="3" height="2"/>
				<tile-range start="140" end="147" width="2" height="3"/>
				<tile-range start="148" end="149" width="3" height="3"/>
				<tile-range start="150" end="158" width="4" height="4"/>
				<tile id="159" width="3" height="5"/>
				<tile id="160" width="5" height="6"/>
				<tile id="161" width="6" height="6"/>
			</tileset>
			<map pattern="campaign/main/surfaces/earth_%d" start="1" end="8"/>
			<weather frequency='4320' duration='120' drop-type='RAIN'/>
		</planet>
		<planet type="frozen" label="planet.type.frozen">
			<body>starmap/planets/planet_ice_30x30</body>
			<equipment>colony/surfaces/frozen/equipment_frozen</equipment>
			<spacewar>colony/surfaces/frozen/spacewar_frozen</spacewar>
			<tileset pattern="colony/surfaces/frozen/tile_frozen_%03d">
				<tile-range start="21" end="32"/>
				<tile-range start="33" end="37" width="2"/>
				<tile-range start="38" end="39" height="2"/>
				<tile-range start="40" end="54" width="2" height="2"/>
				<tile-range start="55" end="59" width="3" height="2"/>
				<tile-range start="60" end="62" width="4" height="2"/>
				<tile-range start="63" end="67" width="2" height="3"/>
				<tile id="68" width="3" height="3"/>
				<tile-range start="69" end="73" width="2" height="4"/>
				<tile-range start="74" end="78" width="4" height="4"/>
				<tile id="79" width="2" height="2"/>
			</tileset>
			<map pattern="campaign/main/surfaces/frozen_%d" start="1" end="9"/>
			<weather frequency='2880' duration='180' drop-type='SNOW'/>
		</planet>
		<planet type="liquid" label="planet.type.liquid">
			<body>starmap/planets/planet_liquid_30x30</body>
			<equipment>colony/surfaces/liquid/equipment_liquid</equipment>
			<spacewar>colony/surfaces/liquid/spacewar_liquid</spacewar>
			<tileset pattern="colony/surfaces/liquid/tile_liquid_%03d">
				<tile-range start="21" end="69"/>
				<tile-range start="70" end="72" width="2"/>
				<tile id="73" height="2"/>
				<tile-range start="74" end="79" width="2" height="2"/>
				<tile-range start="80" end="85"/>
				<tile-range start="86" end="103" width="2" height="2"/>
				<tile-range start="104" end="105" width="3" height="3"/>
				<tile id="106" width="3" height="2"/>
				<tile-range start="107" end="109" width="2" height="3"/>
				<tile-range start="110" end="116" width="3" height="3"/>
				<tile id="117" width="3" height="4"/>
				<tile id="118" width="3" height="3"/>
				<tile-range start="119" end="121" width="4" height="4"/>
				<tile-range start="122" end="123" width="3" height="3"/>
			</tileset>
			<map pattern="campaign/main/surfaces/liquid_%d" start="1" end="8"/>
			<weather frequency='1440' duration='120' drop-type='RAIN'/>
		</planet>
		<planet type="rocky" label="planet.type.rocky">
			<body>starmap/planets/planet_rocky_30x30</body>
			<equipment>colony/surfaces/rocky/equipment_rocky</equipment>
			<spacewar>colony/surfaces/rocky/spacewar_rocky</spacewar>
			<tileset pattern="colony/surfaces/rocky/tile_rocky_%03d">
				<tile-range start="21" end="41"/>
				<tile-range start="42" end="45" width="2"/>
				<tile-range start="46" end="58" width="2" height="2"/>
				<tile-range start="59" end="64" width="4" height="2"/>
				<tile-range start="65" end="71" width="3" height="3"/>
				<tile-range start="72" end="73" width="4" height="4"/>
				<tile id="74" width="5" height="5"/>
			</tileset>
			<map pattern="campaign/main/surfaces/rocky_%d" start="1" end="8"/>
			<weather frequency='5760' duration='120' drop-type='RAIN'/>
		</planet>
	</planets>
	<population-growths>
		<growth type="earth" race="human" value="2.0"/>
		<growth type="rocky" race="human" value="1.5"/>
		<growth type="cratered" race="human" value="1.25"/>
		<growth type="frozen" race="human" value="0.75"/>
		<growth type="liquid" race="human" value="0.75"/>
		<growth type="neptoplasm" race="human" value="0.5"/>
		<growth type="desert" race="human" value="0.5"/>
		<growth type="liquid" race="dargslan" value="2"/>
		<growth type="earth" race="dargslan" value="0.5"/>
		<growth type="frozen" race="garthog" value="2"/>
		<growth type="liquid" race="garthog" value="0.5"/>
		<growth type="desert" race="morgath" value="2"/>
		<growth type="liquid" race="sullep" value="1.25"/>
		<growth type="earth" race="sullep" value="0.75"/>
		<growth type="rocky" race="sullep" value="1.5"/>
		<growth type="desert" race="sullep" value="1.25"/>
		<growth type="neptoplasm" race="ecalep" value="2"/>
		<growth type="desert" race="ecalep" value="0.5"/>
		<growth type="frozen" race="ecalep" value="0.75"/>
		<growth type="rocky" race="ychom" value="2"/>
		<growth type="cratered" race="ychom" value="1.5"/>
		<growth type="rocky" race="dribs" value="2"/>
		<growth type="liquid" race="dribs" value="0.5"/>
	</population-growths>
	<planet-naming>
		<single label='planets.earth'>Earth</single>
		<single>Myridan</single>
		<single>Achilles</single>
		<single>Centronom</single>
		<single>Zeuson</single>
		<single>Naxos</single>
		<single>San Sterling</single>
		<single>Edgepolis</single>
		<single>Giantropolis</single>
		<single>New Caroline</single>
		
		<multiple>Center</multiple>
		<multiple>Outer</multiple>
		<multiple>Andromeda</multiple>
		<multiple>Exterior</multiple>
		<multiple>Garthog</multiple>
		<multiple>Magellan</multiple>
		<multiple>Persol</multiple>
	</planet-naming>
</galaxy>
